{"ambiguities":[],"artifact_role":"runtime_artifact","conflicts":[],"constraints":[{"category":"scope","constraint_id":"C1","expression":{"args":[{"ref":"comparison.interventions"},{"set":["exercise","calorie restriction","sleep optimization","metformin","rapamycin","senolytics"]}],"op":"contains_all"},"source_spans":[[23,110]],"statement":"The comparison must cover exercise, calorie restriction, sleep optimization, metformin, rapamycin, and senolytics."},{"category":"content","constraint_id":"C2","expression":{"args":[{"ref":"evidence.categories"},{"set":["human","animal"]}],"op":"contains_all"},"source_spans":[[139,183]],"statement":"Evidence must be separated into human and animal evidence."},{"category":"preference","constraint_id":"C3","expression":{"ref":"uncertainty.clearly_reported"},"source_spans":[[188,214]],"statement":"Uncertainty must be reported clearly."}],"generation":0,"goals":[{"goal_id":"G1","source_spans":[[0,214]],"statement":"Systematically compare the specified longevity interventions, separate human evidence from animal evidence, and report uncertainty clearly."}],"intent_ir_id":"intent-ir-10-research-longevity-interventions-retry-01","outcomes":[{"class":"information","description":"A systematic comparison of exercise, calorie restriction, sleep optimization, metformin, rapamycin, and senolytics as longevity interventions.","outcome_id":"D1","source_spans":[[0,138]]},{"class":"information","description":"Evidence separated into human and animal evidence.","outcome_id":"D2","source_spans":[[139,183]]},{"class":"information","description":"Uncertainty reported clearly.","outcome_id":"D3","source_spans":[[188,214]]}],"producer":{"method":"model","model":"gpt-5.6-luna","provider":"codex"},"raw_intent_ref":{"raw_intent_id":"10-research-longevity-interventions-retry-01","raw_text_sha256":"ce237205f1b7adcec9100df6cf458443985f4999d138d669c008701fac50cecd"},"schema_version":"solar.intent_ir.v3","unknowns":[]}
