{"ambiguities":[],"artifact_role":"runtime_artifact","conflicts":[],"constraints":[{"category":"scope","constraint_id":"C1","expression":{"ref":"analysis_scope"},"source_spans":[[82,157]],"statement":"Only the explicitly listed strategies should be compared: trees, reflective roofs, green roofs, shade structures, and cooling centers."},{"category":"content","constraint_id":"C2","expression":{"ref":"comparison_metrics"},"source_spans":[[158,209]],"statement":"Evaluation must be performed on the four requested criteria: effectiveness, cost, equity, and scalability."},{"category":"content","constraint_id":"C3","expression":{"ref":"target_context"},"source_spans":[[57,73]],"statement":"The comparison context is dense cities."}],"generation":0,"goals":[{"goal_id":"G1","source_spans":[[0,73]],"statement":"Identify how well urban heat-mitigation strategies perform in dense cities."},{"goal_id":"G2","source_spans":[[74,157]],"statement":"Compare trees, reflective roofs, green roofs, shade structures, and cooling centers."},{"goal_id":"G3","source_spans":[[158,209]],"statement":"Use effectiveness, cost, equity, and scalability as the comparison dimensions."},{"goal_id":"G4","source_spans":[[0,209]],"statement":"Determine which strategy or strategies perform best under the requested criteria."}],"intent_ir_id":"intent-ir-03-research-urban-heat-mitigation","outcomes":[{"class":"information","description":"A comparative assessment that ranks or profiles the five specified strategies in dense cities across effectiveness, cost, equity, and scalability.","outcome_id":"D1","source_spans":[[0,209]]},{"class":"information","description":"A recommendation summary of tradeoffs across the four criteria to support selecting the best-performing strategy set.","outcome_id":"D2","source_spans":[[0,209]]}],"producer":{"method":"model","model":"gpt-5.3-codex-spark","provider":"codex"},"raw_intent_ref":{"raw_intent_id":"03-research-urban-heat-mitigation","raw_text_sha256":"e8a7678b2dceb98bf8092a9116fcb7bd050b513025c93d6e6612abb623aefaa2"},"schema_version":"solar.intent_ir.v3","unknowns":[{"derived_from":["G1"],"kind":"design_parameter","question":"What operational definition of \"dense cities\" should govern the comparison (e.g., density thresholds or urban form categories)?","resolution":{"mode":"workflow_discovery","required_before":"scope lock-in of evaluation geography"},"unknown_id":"U1"},{"derived_from":["G4"],"kind":"selection_decision","question":"How should \"works best\" be operationalized across criteria (single weighted score, multi-criteria ranking, or criterion-by-criterion recommendations)?","resolution":{"mode":"workflow_design","required_before":"final recommendation framing"},"unknown_id":"U2"},{"derived_from":["G3"],"kind":"design_parameter","question":"What cost/effectiveness units and normalizations are expected (for example, per-building, per-area, annualized, and lifecycle timing)?","resolution":{"mode":"workflow_analysis","required_before":"comparative scoring of strategies"},"unknown_id":"U3"}]}
